{
  "acceptance": {
    "accepted_scope": [
      "archive-layout-and-metadata",
      "archive-license-and-vendor-inventory",
      "payload-byte-identity",
      "registered-future-isolated-build-input"
    ],
    "decision": "accepted-for-controlled-build-input",
    "excluded_scope": [
      "artifact-execution",
      "artifact-installation",
      "binary-source-reproducibility",
      "checker-implementation-correctness",
      "cross-platform-equivalence",
      "legal-compliance-for-any-specific-distribution",
      "publisher-signature-verification"
    ],
    "review_date": "2026-08-23"
  },
  "artifact": {
    "bytes": "64772572",
    "filename": "go1.26.7.darwin-arm64.tar.gz",
    "platform": "macos-arm64",
    "tool": "go-toolchain",
    "version": "go1.26.7"
  },
  "dependency_inventory": {
    "manifest_count": "3",
    "manifests": [
      {
        "bytes": "86",
        "path": "go/src/cmd/compile/internal/ssa/_gen/vendor/modules.txt",
        "raw_sha256": "sha256:a4fd613f5489e75daebc987afd1019ff9bbb2d67e008c4dc850a2f41041cbe13"
      },
      {
        "bytes": "5955",
        "path": "go/src/cmd/vendor/modules.txt",
        "raw_sha256": "sha256:9a5563348644d584def106a66119801a70afadca479e4c830835e9c4658ad69d"
      },
      {
        "bytes": "807",
        "path": "go/src/vendor/modules.txt",
        "raw_sha256": "sha256:1bfe5d0b8f7a98496c079c194fbf1b25d20a71639fa21f47c7a3a20698b55fb0"
      }
    ],
    "module_count": "17",
    "modules": [
      {
        "manifest": "go/src/cmd/compile/internal/ssa/_gen/vendor/modules.txt",
        "module": "golang.org/x/tools",
        "version": "v0.27.0"
      },
      {
        "manifest": "go/src/cmd/vendor/modules.txt",
        "module": "github.com/google/pprof",
        "version": "v0.0.0-20251114195745-4902fdda35c8"
      },
      {
        "manifest": "go/src/cmd/vendor/modules.txt",
        "module": "github.com/ianlancetaylor/demangle",
        "version": "v0.0.0-20250417193237-f615e6bd150b"
      },
      {
        "manifest": "go/src/cmd/vendor/modules.txt",
        "module": "golang.org/x/arch",
        "version": "v0.23.0"
      },
      {
        "manifest": "go/src/cmd/vendor/modules.txt",
        "module": "golang.org/x/build",
        "version": "v0.0.0-20251128064159-b9bfd88b30e8"
      },
      {
        "manifest": "go/src/cmd/vendor/modules.txt",
        "module": "golang.org/x/mod",
        "version": "v0.30.1-0.20260813213631-9239cba97fbe"
      },
      {
        "manifest": "go/src/cmd/vendor/modules.txt",
        "module": "golang.org/x/sync",
        "version": "v0.19.0"
      },
      {
        "manifest": "go/src/cmd/vendor/modules.txt",
        "module": "golang.org/x/sys",
        "version": "v0.39.0"
      },
      {
        "manifest": "go/src/cmd/vendor/modules.txt",
        "module": "golang.org/x/telemetry",
        "version": "v0.0.0-20251128220624-abf20d0e57ec"
      },
      {
        "manifest": "go/src/cmd/vendor/modules.txt",
        "module": "golang.org/x/term",
        "version": "v0.38.0"
      },
      {
        "manifest": "go/src/cmd/vendor/modules.txt",
        "module": "golang.org/x/text",
        "version": "v0.32.0"
      },
      {
        "manifest": "go/src/cmd/vendor/modules.txt",
        "module": "golang.org/x/tools",
        "version": "v0.39.1-0.20260527181557-0f52e3809b35"
      },
      {
        "manifest": "go/src/cmd/vendor/modules.txt",
        "module": "rsc.io/markdown",
        "version": "v0.0.0-20240306144322-0bf8f97ee8ef"
      },
      {
        "manifest": "go/src/vendor/modules.txt",
        "module": "golang.org/x/crypto",
        "version": "v0.46.1-0.20251210140736-7dacc380ba00"
      },
      {
        "manifest": "go/src/vendor/modules.txt",
        "module": "golang.org/x/net",
        "version": "v0.47.1-0.20260731170545-cb1d721f7fb3"
      },
      {
        "manifest": "go/src/vendor/modules.txt",
        "module": "golang.org/x/sys",
        "version": "v0.39.0"
      },
      {
        "manifest": "go/src/vendor/modules.txt",
        "module": "golang.org/x/text",
        "version": "v0.32.0"
      }
    ],
    "modules_jcs_sha256": "sha256:bec815965e1e511d65b21d2488867fd7fa027e2358585bbbab945d8f1941e6ff",
    "scope": "archive-contained-go-vendor-manifests",
    "status": "inventoried"
  },
  "digest_domain": "radishaxiom.toolchain-payload-acceptance-record.v0.1",
  "format": "radishaxiom-toolchain-payload-acceptance-record",
  "format_version": "0.1",
  "id": "go1.26.7-darwin-arm64-2026-08-23",
  "inspection": {
    "archive": {
      "compression": "gzip",
      "duplicate_path_validation": "passed",
      "gid_values": [
        "0"
      ],
      "gname_values": [
        ""
      ],
      "link_inventory": {
        "count": "0",
        "jcs_sha256": "sha256:4f53cda18c2baa0c0354bb5f9a3ecbe5ed12ab4d8e11ba873c2f11161202b945"
      },
      "link_target_validation": "passed",
      "max_regular_file": {
        "bytes": "24625360",
        "path": "go/pkg/tool/darwin_arm64/compile"
      },
      "member_count": "16701",
      "member_inventory": {
        "count": "16701",
        "jcs_sha256": "sha256:5317fd31b65787471be3b270ad73986767edb01063377ac041a98261e4dcdd00"
      },
      "mode_values": [
        "0644",
        "0755"
      ],
      "mtime": {
        "maximum": "1787089461",
        "minimum": "1787089461",
        "unique_count": "1"
      },
      "path_validation": "passed",
      "permission_validation": "passed",
      "special_file_validation": "passed",
      "top_level": "go",
      "total_regular_bytes": "228748173",
      "type_counts": {
        "directory": "1667",
        "file": "15034",
        "hardlink": "0",
        "symlink": "0"
      },
      "uid_values": [
        "0"
      ],
      "uname_values": [
        ""
      ]
    },
    "layout_assertions": [
      {
        "expectation": "present",
        "path": "go/LICENSE"
      },
      {
        "expectation": "present",
        "path": "go/PATENTS"
      },
      {
        "expectation": "present",
        "path": "go/VERSION"
      },
      {
        "expectation": "present",
        "path": "go/bin/go"
      },
      {
        "expectation": "present",
        "path": "go/bin/gofmt"
      },
      {
        "expectation": "present",
        "path": "go/pkg/tool/darwin_arm64/compile"
      },
      {
        "expectation": "present",
        "path": "go/pkg/tool/darwin_arm64/link"
      },
      {
        "expectation": "present",
        "path": "go/src/make.bash"
      }
    ],
    "method": {
      "path": "scripts/inspect-toolchain-tar.py",
      "raw_sha256": "sha256:c098e87a566d2883754aad71baa4db1164071d48688a59290fbca551ae225f9f"
    },
    "observation": {
      "path": "contracts/toolchain-payload-acceptance-v0.1/observations/go1.26.7-darwin-arm64.inspection.json",
      "raw_sha256": "sha256:d8adafaf7ed11d2d06207079bd03b244d6bfddae75a7f52161f7b93a35ae93ce"
    },
    "profile": "go1.26.7-darwin-arm64-host",
    "result": "passed"
  },
  "license_review": {
    "conclusions": [
      {
        "components": [
          "BSD-3-Clause"
        ],
        "conclusion": "BSD-3-Clause",
        "file_count": "1",
        "raw_sha256": "sha256:154c946c17de61ca71d28e13673d76a5798e6e25995a7397fbae157afc8f62b4",
        "role": "license"
      },
      {
        "components": [
          "BSD-3-Clause"
        ],
        "conclusion": "BSD-3-Clause",
        "file_count": "1",
        "raw_sha256": "sha256:2d36597f7117c38b006835ae7f537487207d8ec407aa9d9980794b2030cbc067",
        "role": "license"
      },
      {
        "components": [
          "BSD-3-Clause",
          "ISC",
          "OpenSSL",
          "SSLeay-standalone"
        ],
        "conclusion": "LicenseRef-Go-BoringCrypto-Bundle",
        "file_count": "1",
        "raw_sha256": "sha256:56210f826b8f0fbac3160dfe55c97f4019eb6cdda3963b5a0eab8a8bdb62360e",
        "role": "composite-license-bundle"
      },
      {
        "components": [
          "BSD-3-Clause"
        ],
        "conclusion": "BSD-3-Clause",
        "file_count": "1",
        "raw_sha256": "sha256:8cda009bd927676a95ee7ce2dae921442ac4d9584d041b56ecfcba6839032f0b",
        "role": "license"
      },
      {
        "components": [
          "BSD-3-Clause"
        ],
        "conclusion": "BSD-3-Clause",
        "file_count": "14",
        "raw_sha256": "sha256:911f8f5782931320f5b8d1160a76365b83aea6447ee6c04fa6d5591467db9dad",
        "role": "license"
      },
      {
        "components": [],
        "conclusion": "PatentGrant-Go",
        "file_count": "15",
        "raw_sha256": "sha256:96f408bfae65bf137fc2525d3ecb030271c50c1e90799f87abf8846d8dd505cc",
        "role": "patent-grant"
      },
      {
        "components": [
          "BSD-3-Clause"
        ],
        "conclusion": "BSD-3-Clause",
        "file_count": "1",
        "raw_sha256": "sha256:b73277f7730993ef8e7f80aed83e5309762fed4d77eced982abb2c00657c074d",
        "role": "license"
      },
      {
        "components": [
          "Apache-2.0"
        ],
        "conclusion": "Apache-2.0",
        "file_count": "1",
        "raw_sha256": "sha256:cfc7749b96f63bd31c3c42b5c471bf756814053e847c10f3eb003417bc523d30",
        "role": "license"
      },
      {
        "components": [
          "MIT"
        ],
        "conclusion": "MIT",
        "file_count": "1",
        "raw_sha256": "sha256:f99df8ae6da6de047ed002d9dbe8682d9a19c88e9a7473abdadf3ac206621a85",
        "role": "license"
      }
    ],
    "inventory_count": "36",
    "inventory_jcs_sha256": "sha256:2b26f058980c9055b05aba3f2095556640a0702da7cf3dad9cb7521835c8f5cc",
    "main_expression": "BSD-3-Clause",
    "main_license": {
      "bytes": "1453",
      "path": "go/LICENSE",
      "raw_sha256": "sha256:911f8f5782931320f5b8d1160a76365b83aea6447ee6c04fa6d5591467db9dad"
    },
    "patent_grant": {
      "bytes": "1303",
      "path": "go/PATENTS",